{
  "$schema": "https://json-schema.org/draft/2020-12/schema",
  "$id": "https://raw.githubusercontent.com/KuRue/bram-hardware-recipes/main/schema/source-index.schema.json",
  "title": "Bram hardware recipe source index",
  "description": "The entry document of a recipe source: what it is, which snapshot it is, and the SHA-256 of every recipe file it lists. The hashes check integrity, not authorship — a matching hash says the bytes arrived whole, not who wrote them.",
  "type": "object",
  "additionalProperties": false,
  "required": [
    "schema",
    "schemaVersion",
    "source",
    "revision",
    "generatedAt",
    "recipes"
  ],
  "properties": {
    "schema": {
      "const": "bram.hardware-recipes.index"
    },
    "schemaVersion": {
      "const": 1
    },
    "source": {
      "type": "object",
      "additionalProperties": false,
      "required": [
        "id",
        "name",
        "kind"
      ],
      "properties": {
        "id": {
          "type": "string",
          "pattern": "^[a-z0-9][a-z0-9._:-]{2,120}$"
        },
        "name": {
          "type": "string",
          "minLength": 1,
          "maxLength": 120
        },
        "kind": {
          "enum": [
            "official",
            "external"
          ],
          "description": "Trust is decided by this field, so it is required rather than defaulted."
        }
      }
    },
    "revision": {
      "type": "string",
      "minLength": 1,
      "maxLength": 120
    },
    "generatedAt": {
      "type": "string",
      "pattern": "^\\d{4}-\\d{2}-\\d{2}(T\\d{2}:\\d{2}:\\d{2}Z)?$"
    },
    "recipes": {
      "type": "array",
      "minItems": 1,
      "maxItems": 256,
      "items": {
        "type": "object",
        "additionalProperties": false,
        "required": [
          "id",
          "version",
          "file",
          "sha256"
        ],
        "properties": {
          "id": {
            "type": "string",
            "pattern": "^[a-z0-9][a-z0-9._:-]{2,120}$"
          },
          "version": {
            "type": "integer",
            "minimum": 1,
            "maximum": 1000000
          },
          "file": {
            "type": "string",
            "maxLength": 200,
            "pattern": "^(?!/)(?!.*\\.\\.).+$",
            "description": "A bare file name inside the source: no absolute path, no parent-directory step."
          },
          "sha256": {
            "type": "string",
            "pattern": "^[0-9a-f]{64}$"
          }
        }
      }
    }
  }
}
